{
  "schemaVersion" : "matching.m14.check.v2",
  "unit" : "M14",
  "contractPlanVersion" : "0.17",
  "workloadSha256" : "005afdabc720ab782ea092e416a7d9c1273daf09246eede1e43607ed110ad9e3",
  "profileSha256" : "02ef0ee44900e1a472fea03ed5cb406215550994826b53f4b708e33815c6be9d",
  "corpusSha256" : "634b17ce63eba6aeacd6cab8cc04a69786dac3a3fc15fc8fde1e942b6486e449",
  "status" : "SYSTEM_ERROR",
  "executed" : false,
  "error" : "IllegalStateException: report is not PASS: \"matching.m14.cluster-faults.v1\""
}
